data||type||speaker||lineNumber||songTitle||songNumber||album||
All these fancy things||Intro||Kanye West||29||Family Business||11||The College Dropout||
I tell you that all is my weight and gold||Intro||Kanye West||30||Family Business||11||The College Dropout||
(all that glitters is not gold, now gold is not reality)||Intro||Kanye West||31||Family Business||11||The College Dropout||
Now all I know I know all these things||Intro||Kanye West||32||Family Business||11||The College Dropout||
(real is what you lease on me)||Intro||Kanye West||33||Family Business||11||The College Dropout||
This is family business||Intro||Kanye West||34||Family Business||11||The College Dropout||
And this is for everybody standing with us||Intro||Kanye West||35||Family Business||11||The College Dropout||
Come on, let's take a family Grammy picture||Intro||Kanye West||36||Family Business||11||The College Dropout||
Abi, remember when they ain't believe in me?||Intro||Kanye West||37||Family Business||11||The College Dropout||
Now she like "See, that's my cousin on TV!"||Intro||Kanye West||38||Family Business||11||The College Dropout||
Now, we gettin' it and we gon' make it||Intro||Kanye West||39||Family Business||11||The College Dropout||
And they gon' hate it and I'm his favorite||Intro||Kanye West||40||Family Business||11||The College Dropout||
I can't deny it, I'm a straight rider||Intro||Kanye West||41||Family Business||11||The College Dropout||
But when we get together be electric slidin'||Intro||Kanye West||42||Family Business||11||The College Dropout||
Grandma, get 'em shook up||Intro||Kanye West||43||Family Business||11||The College Dropout||
Aw naw, don't open the photo book up||Intro||Kanye West||44||Family Business||11||The College Dropout||
I got an Aunt Ruth that can't remember your name||Intro||Kanye West||45||Family Business||11||The College Dropout||
But I bet them Polaroids'll send her down memory lane||Intro||Kanye West||46||Family Business||11||The College Dropout||
You know that one auntie, you don't mean to be rude||Intro||Kanye West||47||Family Business||11||The College Dropout||
But every holiday nobody eating her food||Intro||Kanye West||48||Family Business||11||The College Dropout||
And you don't wanna stay there cause them your worst cousins||Intro||Kanye West||49||Family Business||11||The College Dropout||
Got roaches at their crib like them your first cousins||Intro||Kanye West||50||Family Business||11||The College Dropout||
Act like you ain't took a bath with your cousins||Intro||Kanye West||51||Family Business||11||The College Dropout||
Fit 3 in the bed if it's 6 of y'all||Intro||Kanye West||52||Family Business||11||The College Dropout||
I'm talkin' 'bout three by the head and three by the leg||Intro||Kanye West||53||Family Business||11||The College Dropout||
But you ain't have to tell my girl I used to pee in the bed||Intro||Kanye West||54||Family Business||11||The College Dropout||
Rain, rain, rain go away||Intro||Kanye West||55||Family Business||11||The College Dropout||
Let the sun come out and all the children say||Intro||Kanye West||56||Family Business||11||The College Dropout||
Rain, rain, rain go away||Intro||Kanye West||57||Family Business||11||The College Dropout||
Let the sun come out and all the children say||Intro||Kanye West||58||Family Business||11||The College Dropout||
I woke up early this morning with a new state of mind||Intro||Kanye West||59||Family Business||11||The College Dropout||
A creative way to rhyme without using knives and guns||Intro||Kanye West||60||Family Business||11||The College Dropout||
Keep your nose out the sky, keep your heart to God||Intro||Kanye West||61||Family Business||11||The College Dropout||
And keep your face to the risin' sun||Intro||Kanye West||62||Family Business||11||The College Dropout||
All my niggas from the Chi, that's my family, dog||Intro||Kanye West||63||Family Business||11||The College Dropout||
And my niggas ain't my guys, they my family, dog||Intro||Kanye West||64||Family Business||11||The College Dropout||
I feel like one day you'll understand me, dog||Intro||Kanye West||65||Family Business||11||The College Dropout||
You can still love your man and be manly, dog||Intro||Kanye West||66||Family Business||11||The College Dropout||
You ain't got to get heated at every house warmin'||Intro||Kanye West||67||Family Business||11||The College Dropout||
Sittin' here, grillin' people like George Foreman||Intro||Kanye West||68||Family Business||11||The College Dropout||
Why Uncle Ray and Aunt Shiela always performin'?||Intro||Kanye West||69||Family Business||11||The College Dropout||
The second she storm out then he storm in||Intro||Kanye West||70||Family Business||11||The College Dropout||
Y'all gon' sit down, have a good time this reunion||Intro||Kanye West||71||Family Business||11||The College Dropout||
And drink some wine like Communion||Intro||Kanye West||72||Family Business||11||The College Dropout||
And act like everything fine and if it isn't||Intro||Kanye West||73||Family Business||11||The College Dropout||
We ain't letting everybody in our family business, uh||Intro||Kanye West||74||Family Business||11||The College Dropout||
(All all all the diamond rings diamond rings)||Intro||Kanye West||75||Family Business||11||The College Dropout||
They don't mean a thing (all, all, all the things)||Intro||Kanye West||76||Family Business||11||The College Dropout||
They don't mean a thing (all, all, all the things)||Intro||Kanye West||77||Family Business||11||The College Dropout||
(All all that glitters is not gold, now gold is not reality)||Intro||Kanye West||78||Family Business||11||The College Dropout||
They don't mean a thing a thing||Intro||Kanye West||79||Family Business||11||The College Dropout||
(All, all, all the things)||Intro||Kanye West||80||Family Business||11||The College Dropout||
They don't mean a thing a thing a thing||Intro||Kanye West||81||Family Business||11||The College Dropout||
I don't care what they don't mean a thing||Intro||Kanye West||82||Family Business||11||The College Dropout||
(All, all, all the things) all these fancy things||Intro||Kanye West||83||Family Business||11||The College Dropout||
I tell you that all is my weight and gold||Intro||Kanye West||84||Family Business||11||The College Dropout||
All I know, I know all these things||Intro||Kanye West||85||Family Business||11||The College Dropout||
All these things, all these things||Intro||Kanye West||86||Family Business||11||The College Dropout||
All these things, all these things||Intro||Kanye West||87||Family Business||11||The College Dropout||
CLK Mercedes Benz||Intro||Kanye West||88||Family Business||11||The College Dropout||
All these things, all these things ...||Intro||Kanye West||89||Family Business||11||The College Dropout||
All these things, all these things ...||Intro||Kanye West||90||Family Business||11||The College Dropout||
All these things, all these things ...||Intro||Kanye West||91||Family Business||11||The College Dropout||
A whole lotta money||Intro||Kanye West||92||Family Business||11||The College Dropout||
All these things, all these things||Intro||Kanye West||93||Family Business||11||The College Dropout||
All these things, all these things||Intro||Kanye West||94||Family Business||11||The College Dropout||
All these things, all these things||Intro||Kanye West||95||Family Business||11||The College Dropout||
Mommy and Daddy, will you please stop fighting?||Intro||Kanye West||96||Family Business||11||The College Dropout||
All these things, all these things||Intro||Kanye West||97||Family Business||11||The College Dropout||
All these things, (and I don't care why) all these things||Intro||Kanye West||98||Family Business||11||The College Dropout||
All these things, all these things||Intro||Kanye West||99||Family Business||11||The College Dropout||
All these things, all these things...||Intro||Kanye West||100||Family Business||11||The College Dropout||
Let's get Stevie outta jail||Intro||Kanye West||101||Family Business||11||The College Dropout||
You just popped in the Kanye West||Intro||Kanye West||1||The New Workout Plan||11||The College Dropout||
Get Right for the Summer workout tape||Intro||Kanye West||2||The New Workout Plan||11||The College Dropout||
And ladies if you follow these instructions exactly||Intro||Kanye West||3||The New Workout Plan||11||The College Dropout||
You might be able to pull you a rapper, a NBA player||Intro||Kanye West||4||The New Workout Plan||11||The College Dropout||
Man, at least a dude with a car||Intro||Kanye West||5||The New Workout Plan||11||The College Dropout||
So, first of all, we gonna work on the stomach||Intro||Kanye West||6||The New Workout Plan||11||The College Dropout||
Nobody wants a little tight ass||Intro||Kanye West||7||The New Workout Plan||11||The College Dropout||
1, and 2, and 3, and 4, and get them sit ups right, and||Intro||Kanye West||8||The New Workout Plan||11||The College Dropout||
Tuck your tummy tight and do your crunches like this||Intro||Kanye West||9||The New Workout Plan||11||The College Dropout||
Give head, stop, breathe, get up, check your weave||Intro||Kanye West||10||The New Workout Plan||11||The College Dropout||
Don't drop the blunt and disrespect the weed||Intro||Kanye West||11||The New Workout Plan||11||The College Dropout||
Pick up your son and don't disrespect your seed||Intro||Kanye West||12||The New Workout Plan||11||The College Dropout||
It's a party tonight and ooh she's so excited||Intro||Kanye West||13||The New Workout Plan||11||The College Dropout||
Tell me who's invited: you, your friends and my dick||Intro||Kanye West||14||The New Workout Plan||11||The College Dropout||
(AH!) What's scary to me is||Intro||Kanye West||15||The New Workout Plan||11||The College Dropout||
Henny makes girls look like Halle Berry to me||Intro||Kanye West||16||The New Workout Plan||11||The College Dropout||
So excuse me miss, I forgot your name||Intro||Kanye West||17||The New Workout Plan||11||The College Dropout||
Thank you, God bless you, good night I came, I came, I came||Intro||Kanye West||18||The New Workout Plan||11||The College Dropout||
It's been a week without me||Intro||Kanye West||19||The New Workout Plan||11||The College Dropout||
And she feel weak without me||Intro||Kanye West||20||The New Workout Plan||11||The College Dropout||
She wanna talk it out but||Intro||Kanye West||21||The New Workout Plan||11||The College Dropout||
Ain't nothing to talk about||Intro||Kanye West||22||The New Workout Plan||11||The College Dropout||
Unless she's talking about freaking out||Intro||Kanye West||23||The New Workout Plan||11||The College Dropout||
Then maybe we can work it out||Intro||Kanye West||24||The New Workout Plan||11||The College Dropout||
Work it out, work it out||Intro||Kanye West||25||The New Workout Plan||11||The College Dropout||
Work it out, work it out now||Intro||Kanye West||26||The New Workout Plan||11||The College Dropout||
Maybe we can work it out||Intro||Kanye West||27||The New Workout Plan||11||The College Dropout||
Oh, girl, your silhouette make me wanna light a cigarette||Intro||Kanye West||28||The New Workout Plan||11||The College Dropout||
My name Kanye from the Jigga set, Twista said "Get It Wet"||Intro||Kanye West||29||The New Workout Plan||11||The College Dropout||
Ooh girl your breath is harsh!||Intro||Kanye West||30||The New Workout Plan||11||The College Dropout||
Cover your mouth up like you got SARS||Intro||Kanye West||31||The New Workout Plan||11||The College Dropout||
Off them tracks yea I bought them cars||Intro||Kanye West||32||The New Workout Plan||11||The College Dropout||
Still, kill a nigga on 16 bars||Intro||Kanye West||33||The New Workout Plan||11||The College Dropout||
We ain't sweating to the oldies, we juking to a cold beat||Intro||Kanye West||34||The New Workout Plan||11||The College Dropout||
Maybe one day girl we can bone||Intro||Kanye West||35||The New Workout Plan||11||The College Dropout||
So you can brag to all your homies now||Intro||Kanye West||36||The New Workout Plan||11||The College Dropout||
But I still mess with a big girl, if you ain't fit girl, I'll still hit girl||Intro||Kanye West||37||The New Workout Plan||11||The College Dropout||
1 and, you brought 2 friends, ok, 3 more now hop in the Benz||Intro||Kanye West||38||The New Workout Plan||11||The College Dropout||
4-door: do you know the difference between a 5, 6, 7, 8?||Intro||Kanye West||39||The New Workout Plan||11||The College Dropout||
All the mocha lattes, you gotta do Pilates||Intro||Kanye West||40||The New Workout Plan||11||The College Dropout||
You gotta pop this tape in before you start back dating||Intro||Kanye West||41||The New Workout Plan||11||The College Dropout||
Hustlers, gangstas, all us ballas||Intro||Kanye West||42||The New Workout Plan||11||The College Dropout||
It's been a week without me||Intro||Kanye West||43||The New Workout Plan||11||The College Dropout||
And she feel weak without me||Intro||Kanye West||44||The New Workout Plan||11||The College Dropout||
She wanna talk it out but||Intro||Kanye West||45||The New Workout Plan||11||The College Dropout||
Ain't nothing to talk about||Intro||Kanye West||46||The New Workout Plan||11||The College Dropout||
Unless she's talking about freaking out||Intro||Kanye West||47||The New Workout Plan||11||The College Dropout||
Then maybe we can work it out||Intro||Kanye West||48||The New Workout Plan||11||The College Dropout||
Work it out, work it out||Intro||Kanye West||49||The New Workout Plan||11||The College Dropout||
Work it out, work it out now||Intro||Kanye West||50||The New Workout Plan||11||The College Dropout||
Maybe we can work it out||Intro||Kanye West||51||The New Workout Plan||11||The College Dropout||
Hi, my name is Jill, I just want to say thanks to Kanye's workout plan. I was able to pull a NBA player. And like now I shop every day on Rodeo Drive. I just want to say, thank you Kanye! Woooo! Woooo! Woooo!||Intro||Kanye West||52||The New Workout Plan||11||The College Dropout||
My name is Lasandra, and I just want to say that ever since listening to Kanye's workout tape, I was able to get my phone bill paid, I got sounds and 13's put up in my Cavalier and I was able to get a free trip to Cancun. And what's most importantly is that I ain't gotta fuck with Ray-Ray's broke ass no mo'||Intro||Kanye West||53||The New Workout Plan||11||The College Dropout||
Work it (mo')||Intro||Kanye West||54||The New Workout Plan||11||The College Dropout||
Juke it (mo') Pump it (mo')||Intro||Kanye West||55||The New Workout Plan||11||The College Dropout||
Chi-Town (mo') Let's go (mo')||Intro||Kanye West||56||The New Workout Plan||11||The College Dropout||
My name is Ella-May from Mobile, Alabama, and I just want to say since listening to Kanye's workout tape, I been able to date outside the family, I got a double wide, and I rode a plane, rode a plane, rode a plane||Intro||Kanye West||57||The New Workout Plan||11||The College Dropout||
Thanks to Kanye's workout plan||Intro||Kanye West||58||The New Workout Plan||11||The College Dropout||
I'm the envy of all my friends||Intro||Kanye West||59||The New Workout Plan||11||The College Dropout||
See I pulled me a baller man||Intro||Kanye West||60||The New Workout Plan||11||The College Dropout||
And I ain't gotta work at the mall again||Intro||Kanye West||61||The New Workout Plan||11||The College Dropout||
(Lemme break ya wit' a piece of)||Interlude||Bosko & (Kanye)||62||The New Workout Plan||11||The College Dropout||
My favorite work out plan (oh! oh! oh!)||Interlude||Bosko & (Kanye)||63||The New Workout Plan||11||The College Dropout||
I wanna see you work out||Interlude||Bosko & (Kanye)||64||The New Workout Plan||11||The College Dropout||
(Yeah, yeah, yeah, yeah, yeah, yeah, yeah, yeah)||Interlude||Bosko & (Kanye)||65||The New Workout Plan||11||The College Dropout||
I wanna see you work out||Interlude||Bosko & (Kanye)||66||The New Workout Plan||11||The College Dropout||
(It's like that old Michael Jackson shit)||Interlude||Bosko & (Kanye)||67||The New Workout Plan||11||The College Dropout||
That's right, put in work, move your ass, go berserk||Interlude||Bosko & (Kanye)||68||The New Workout Plan||11||The College Dropout||
Eat your salad, no dessert, get that man you deserve||Interlude||Bosko & (Kanye)||69||The New Workout Plan||11||The College Dropout||
It's Kanye's workout plan||Interlude||Bosko & (Kanye)||70||The New Workout Plan||11||The College Dropout||
I said it's Kanye's workout plan (Ladies and gentlemen)||Interlude||Bosko & (Kanye)||71||The New Workout Plan||11||The College Dropout||
It's Kanye's workout plan (Allow myself to introduce myself)||Interlude||Bosko & (Kanye)||72||The New Workout Plan||11||The College Dropout||
His workout plan (This time around, I want y'all to clap like this)||Interlude||Bosko & (Kanye)||73||The New Workout Plan||11||The College Dropout||
That's right, put in work||Interlude||Bosko & (Kanye)||74||The New Workout Plan||11||The College Dropout||
Move your ass, go berserk||Interlude||Bosko & (Kanye)||75||The New Workout Plan||11||The College Dropout||
Eat your salad, no dessert||Interlude||Bosko & (Kanye)||76||The New Workout Plan||11||The College Dropout||
Get that man you deserve (Stop!)||Interlude||Bosko & (Kanye)||77||The New Workout Plan||11||The College Dropout||
It's Kanye's workout plan (Okay, breathe)||Interlude||Bosko & Kanye||78||The New Workout Plan||11||The College Dropout||
I said it's Kanye's workout plan (I know y'all ain't tired)||Interlude||Bosko & Kanye||79||The New Workout Plan||11||The College Dropout||
It's Kanye's workout plan (But I hope not 'cuz on this one I need ya)||Interlude||Bosko & Kanye||80||The New Workout Plan||11||The College Dropout||
His workout plan (To give me a soul clap, okay?)||Interlude||Bosko & Kanye||81||The New Workout Plan||11||The College Dropout||
(Double time)||Interlude||Bosko & Kanye||82||The New Workout Plan||11||The College Dropout||
That's right, put in work (Woo!)||Bridge||GLC & Kanye||83||The New Workout Plan||11||The College Dropout||
Move your ass, go berserk (Ow!)||Bridge||GLC & Kanye||84||The New Workout Plan||11||The College Dropout||
Eat your salad, no dessert (Ugh!)||Bridge||GLC & Kanye||85||The New Workout Plan||11||The College Dropout||
Get that man you deserve||Bridge||GLC & Kanye||86||The New Workout Plan||11||The College Dropout||
That's right, put in work (Put in work)||Bridge||GLC & Kanye||87||The New Workout Plan||11||The College Dropout||
Move your ass, go berserk (Go wizzerk)||Bridge||GLC & Kanye||88||The New Workout Plan||11||The College Dropout||
Eat your salad, no dessert (No dessert)||Bridge||GLC & Kanye||89||The New Workout Plan||11||The College Dropout||
Get that man you deserve (You hear, ugh)||Bridge||GLC & Kanye||90||The New Workout Plan||11||The College Dropout||
That's right, put in work (That's right put in work)||Bridge||GLC & Kanye||91||The New Workout Plan||11||The College Dropout||
Move your ass, go berserk (Go wizzerk)||Bridge||GLC & Kanye||92||The New Workout Plan||11||The College Dropout||
Eat your salad, no dessert (Eat your salad, no dessert)||Bridge||GLC & Kanye||93||The New Workout Plan||11||The College Dropout||
Get that man you deserve (Woo!)||Bridge||GLC & Kanye||94||The New Workout Plan||11||The College Dropout||
(Okay, okay, okay, that's very good good)||Outro||Bosko & Kanye||95||The New Workout Plan||11||The College Dropout||
(I appreciate your time)||Outro||Bosko & Kanye||96||The New Workout Plan||11||The College Dropout||
I want to see you work out for me||Outro||Bosko & Kanye||97||The New Workout Plan||11||The College Dropout||
Whoa, yeah, whoa yeah||Outro||Bosko & Kanye||98||The New Workout Plan||11||The College Dropout||
Do-do-do-do-do-do-do-do-do-do, yo||Outro||Bosko & Kanye||99||The New Workout Plan||11||The College Dropout||
(Hey Mama)||Intro||Kanye West||1||Hey Mama||12||The College Dropout||
I wanna scream so loud for you, 'cause I'm so proud of you||Intro||Kanye West||2||Hey Mama||12||The College Dropout||
Let me tell you what I'm about to do||Intro||Kanye West||3||Hey Mama||12||The College Dropout||
(Hey Mama)||Intro||Kanye West||4||Hey Mama||12||The College Dropout||
I know I act a fool but, I promise you I'm goin' back to school||Intro||Kanye West||5||Hey Mama||12||The College Dropout||
I appreciate what you allowed for me||Intro||Kanye West||6||Hey Mama||12||The College Dropout||
I just want you to be proud of me||Intro||Kanye West||7||Hey Mama||12||The College Dropout||
(Hey Mama)||Intro||Kanye West||8||Hey Mama||12||The College Dropout||
I wanna tell the whole world about a friend of mine||Intro||Kanye West||9||Hey Mama||12||The College Dropout||
This little light of mine and I'm finna let it shine||Intro||Kanye West||10||Hey Mama||12||The College Dropout||
I'm finna take y'all back to them better times||Intro||Kanye West||11||Hey Mama||12||The College Dropout||
I'm finna talk about my mama if y'all don't mind||Intro||Kanye West||12||Hey Mama||12||The College Dropout||
I was three years old when you and I moved to the Chi||Intro||Kanye West||13||Hey Mama||12||The College Dropout||
Late December, harsh winter gave me a cold||Intro||Kanye West||14||Hey Mama||12||The College Dropout||
You fixed me up something that was good for my soul||Intro||Kanye West||15||Hey Mama||12||The College Dropout||
Famous homemade chicken soup, can I have another bowl?||Intro||Kanye West||16||Hey Mama||12||The College Dropout||
You work late nights just to keep on the lights||Intro||Kanye West||17||Hey Mama||12||The College Dropout||
Mommy got me training wheels so I could keep on my bike||Intro||Kanye West||18||Hey Mama||12||The College Dropout||
And you would give anything in this world||Intro||Kanye West||19||Hey Mama||12||The College Dropout||
Michael Jackson leather and a glove, but didn't give me a curl||Intro||Kanye West||20||Hey Mama||12||The College Dropout||
And you never put no man over me||Intro||Kanye West||21||Hey Mama||12||The College Dropout||
And I love you for that, mommy, can't you see?||Intro||Kanye West||22||Hey Mama||12||The College Dropout||
Seven years old, caught you with tears in your eyes||Intro||Kanye West||23||Hey Mama||12||The College Dropout||
'Cause a nigga cheatin', telling you lies, then I started to cry||Intro||Kanye West||24||Hey Mama||12||The College Dropout||
As we knelt on the kitchen floor||Intro||Kanye West||25||Hey Mama||12||The College Dropout||
I said mommy I'ma love you 'til you don't hurt no more||Intro||Kanye West||26||Hey Mama||12||The College Dropout||
And when I'm older, you ain't gotta work no more||Intro||Kanye West||27||Hey Mama||12||The College Dropout||
And I'ma get you that mansion that we couldn't afford||Intro||Kanye West||28||Hey Mama||12||The College Dropout||
See you're unbreakable, unmistakable||Intro||Kanye West||29||Hey Mama||12||The College Dropout||
Highly capable, lady that's makin' loot||Intro||Kanye West||30||Hey Mama||12||The College Dropout||
A livin' legend too, just look at what heaven do||Intro||Kanye West||31||Hey Mama||12||The College Dropout||
Send us an angel, and I thank you (Hey Mama)||Intro||Kanye West||32||Hey Mama||12||The College Dropout||
(Hey Mama)||Intro||Kanye West||33||Hey Mama||12||The College Dropout||
I wanna scream so loud for you, 'cause I'm so proud of you||Intro||Kanye West||34||Hey Mama||12||The College Dropout||
Let me tell you what I'm about to do||Intro||Kanye West||35||Hey Mama||12||The College Dropout||
(Hey Mama)||Intro||Kanye West||36||Hey Mama||12||The College Dropout||
I know I act a fool but, I promise you I'm goin' back to school||Intro||Kanye West||37||Hey Mama||12||The College Dropout||
I appreciate what you allowed for me||Intro||Kanye West||38||Hey Mama||12||The College Dropout||
I just want you to be proud of me||Intro||Kanye West||39||Hey Mama||12||The College Dropout||
(Hey Mama)||Intro||Kanye West||40||Hey Mama||12||The College Dropout||
Forrest Gump mama said, "Life is like a box of chocolates"||Intro||Kanye West||41||Hey Mama||12||The College Dropout||
My mama told me go to school, get your doctorate||Intro||Kanye West||42||Hey Mama||12||The College Dropout||
Somethin to fall back on, you could profit with||Intro||Kanye West||43||Hey Mama||12||The College Dropout||
But still supported me when I did the opposite||Intro||Kanye West||44||Hey Mama||12||The College Dropout||
Now I feel like it's things I gotta get||Intro||Kanye West||45||Hey Mama||12||The College Dropout||
Things I gotta do, just to prove to you||Intro||Kanye West||46||Hey Mama||12||The College Dropout||
You was getting through, can the choir, please||Intro||Kanye West||47||Hey Mama||12||The College Dropout||
Give me a verse of "You Are So Beautiful To Me"||Intro||Kanye West||48||Hey Mama||12||The College Dropout||
Can't you see, you're like a book of poetry||Intro||Kanye West||49||Hey Mama||12||The College Dropout||
Maya Angelou, Nikki Giovanni, turn one page and there's my mommy||Intro||Kanye West||50||Hey Mama||12||The College Dropout||
Come on mommy just dance wit' me, let the whole world see your dancing feet||Intro||Kanye West||51||Hey Mama||12||The College Dropout||
Now when I say Hey, y'all say, Mama, now everybody answer me (Hey Mama)||Intro||Kanye West||52||Hey Mama||12||The College Dropout||
(Hey Mama)||Intro||Kanye West||53||Hey Mama||12||The College Dropout||
I wanna scream so loud for you, 'cause I'm so proud of you||Intro||Kanye West||54||Hey Mama||12||The College Dropout||
Let me tell you what I'm about to do||Intro||Kanye West||55||Hey Mama||12||The College Dropout||
(Hey Mama)||Intro||Kanye West||56||Hey Mama||12||The College Dropout||
I know I act a fool but, I promise you I'm goin' back to school||Intro||Kanye West||57||Hey Mama||12||The College Dropout||
I appreciate what you allowed for me||Intro||Kanye West||58||Hey Mama||12||The College Dropout||
I just want you to be proud of me||Intro||Kanye West||59||Hey Mama||12||The College Dropout||
