data||type||speaker||lineNumber||songTitle||songNumber||album||
Make no mistake, girl, still love you||Chorus||Charlie Wilson & Kid Cudi (Slick Rick)||31||No Mistakes||5||ye||
Fallin', dreamin', talkin' in your sleep||Intro||070 Shake||1||Violent Crimes||7||ye||
I know you want to cry all night, all night||Intro||070 Shake||2||Violent Crimes||7||ye||
Plottin', schemin', findin'||Intro||070 Shake||3||Violent Crimes||7||ye||
Reason to defend all of your violent nights||Intro||070 Shake||4||Violent Crimes||7||ye||
Promise me you will see||Intro||070 Shake||5||Violent Crimes||7||ye||
Don't you grow up in a hurry, your mom'll be worried, aw||Chorus||070 Shake||6||Violent Crimes||7||ye||
It was all part of the story, even the scary nights||Chorus||070 Shake||7||Violent Crimes||7||ye||
Thank you for all of the glory, you will be remembered, aw||Chorus||070 Shake||8||Violent Crimes||7||ye||
Thank you to all of the heroes of the night (night, night)||Chorus||070 Shake||9||Violent Crimes||7||ye||
They gotta repaint the colors, the lie is wearin' off||Chorus||070 Shake||10||Violent Crimes||7||ye||
Reality is upon us, colors drippin' off||Chorus||070 Shake||11||Violent Crimes||7||ye||
Colors drippin' off||Chorus||070 Shake||12||Violent Crimes||7||ye||
Niggas is savage, niggas is monsters||Verse||Kanye West||13||Violent Crimes||7||ye||
Niggas is pimps, niggas is players||Verse||Kanye West||14||Violent Crimes||7||ye||
'Til niggas have daughters, now they precautious||Verse||Kanye West||15||Violent Crimes||7||ye||
Father, forgive me, I'm scared of the karma||Verse||Kanye West||16||Violent Crimes||7||ye||
'Cause now I see women as somethin' to nurture||Verse||Kanye West||17||Violent Crimes||7||ye||
Not somethin' to conquer||Verse||Kanye West||18||Violent Crimes||7||ye||
I hope she like Nicki, I make her a monster||Verse||Kanye West||19||Violent Crimes||7||ye||
Not havin' ménages, I'm just bein' silly||Verse||Kanye West||20||Violent Crimes||7||ye||
I answered the door like Will Smith and Martin||Verse||Kanye West||21||Violent Crimes||7||ye||
Nigga, do we have a problem?||Verse||Kanye West||22||Violent Crimes||7||ye||
Matter fact, Marlon, this ain't Meet the Fockers||Verse||Kanye West||23||Violent Crimes||7||ye||
I'll beat his ass, pray I beat the charges||Verse||Kanye West||24||Violent Crimes||7||ye||
No, Daddy don't play, not when it come to they daughters||Verse||Kanye West||25||Violent Crimes||7||ye||
Don't do no yoga, don't do pilates||Verse||Kanye West||26||Violent Crimes||7||ye||
Just play piano and stick to karate||Verse||Kanye West||27||Violent Crimes||7||ye||
I pray your body's draped more like mine||Verse||Kanye West||28||Violent Crimes||7||ye||
And not like your mommy's||Verse||Kanye West||29||Violent Crimes||7||ye||
Just bein' salty, but niggas is nuts||Verse||Kanye West||30||Violent Crimes||7||ye||
And I am a nigga, I know what they want||Verse||Kanye West||31||Violent Crimes||7||ye||
I pray that you don't get it all at once||Verse||Kanye West||32||Violent Crimes||7||ye||
Curves under your dress, I know it's pervs all on the net||Verse||Kanye West||33||Violent Crimes||7||ye||
All in the comments, you wanna vomit||Verse||Kanye West||34||Violent Crimes||7||ye||
That's your baby, you love her to death||Verse||Kanye West||35||Violent Crimes||7||ye||
Now she cuttin' class and hangin' with friends||Verse||Kanye West||36||Violent Crimes||7||ye||
You break a glass and say it again||Verse||Kanye West||37||Violent Crimes||7||ye||
She can't comprehend the danger she in||Verse||Kanye West||38||Violent Crimes||7||ye||
If you whoop her ass, she move in with him||Verse||Kanye West||39||Violent Crimes||7||ye||
Then he whoop her ass, you go through it again||Verse||Kanye West||40||Violent Crimes||7||ye||
But how you the devil rebukin' the sin?||Verse||Kanye West||41||Violent Crimes||7||ye||
Let's pray we can put this behind us||Verse||Kanye West||42||Violent Crimes||7||ye||
I swear that these times is the wildest||Verse||Kanye West||43||Violent Crimes||7||ye||
She got the scars, they serve as reminders||Verse||Kanye West||44||Violent Crimes||7||ye||
Blood still on her pajamas||Verse||Kanye West||45||Violent Crimes||7||ye||
But yesterday is dead, yeah, moment of silence||Verse||Kanye West||46||Violent Crimes||7||ye||
Next, she'll be off to college and then at the altar||Verse||Kanye West||47||Violent Crimes||7||ye||
'Cause she know that niggas is savage, niggas is monsters||Verse||Kanye West||48||Violent Crimes||7||ye||
Niggas is pimps, niggas is players, 'til niggas have daughters||Verse||Kanye West||49||Violent Crimes||7||ye||
Niggas is pimps, niggas is players, 'til niggas have daughters||Verse||Kanye West||50||Violent Crimes||7||ye||
Don't you grow up in a hurry, your mom'll be worried, aw||Chorus||070 Shake & Ty Dolla $ign||51||Violent Crimes||7||ye||
It was all part of the story, even the scary nights||Chorus||070 Shake & Ty Dolla $ign||52||Violent Crimes||7||ye||
Thank you for all of the glory, you will be remembered, aw||Chorus||070 Shake & Ty Dolla $ign||53||Violent Crimes||7||ye||
Thank you to all of the heroes of the night (night, night)||Chorus||070 Shake & Ty Dolla $ign||54||Violent Crimes||7||ye||
They gotta repaint the colors, the lie is wearin' off||Chorus||070 Shake & Ty Dolla $ign||55||Violent Crimes||7||ye||
Reality is upon us, colors drippin' off||Chorus||070 Shake & Ty Dolla $ign||56||Violent Crimes||7||ye||
Colors drippin' off||Chorus||070 Shake & Ty Dolla $ign||57||Violent Crimes||7||ye||
I'm saying it like...||Outro||Nicki Minaj||58||Violent Crimes||7||ye||
"I want a daughter like Nicki, aw, man, I promise||Outro||Nicki Minaj||59||Violent Crimes||7||ye||
I'ma turn her to a monster, but no ménages"||Outro||Nicki Minaj||60||Violent Crimes||7||ye||
I don't know how you saying it but, let 'em hear this||Outro||Nicki Minaj||61||Violent Crimes||7||ye||